{
  "$schema": "../schemas/palette.schema.json",
  "name": "Ink & Blossom — Spring Herbarium v2",
  "appearance": "dark",
  "settings": { "italics": true },
  "colors": {
    "rosewater": "#fdd4bd",
    "flamingo": "#f37f94",
    "pink": "#f37f94",
    "mauve": "#ca92a8",
    "red": "#f48067",
    "maroon": "#a36752",
    "peach": "#eeb480",
    "yellow": "#fbe6a0",
    "green": "#96d1aa",
    "teal": "#96d1aa",
    "sky": "#b5decc",
    "sapphire": "#b4cdc2",
    "blue": "#96d1aa",
    "lavender": "#b5decc",
    "text": "#b5decc",
    "subtext1": "#c7cbc8",
    "subtext0": "#9fa5a1",
    "overlay2": "#b4cdc2",
    "overlay1": "#7f9b8f",
    "overlay0": "#5a6e64",
    "surface2": "#333c35",
    "surface1": "#252d27",
    "surface0": "#171d19",
    "base": "#0b0f0d",
    "mantle": "#101512",
    "crust": "#080b09"
  }
}
