{
  "$schema": "../schemas/palette.schema.json",
  "name": "Ink & Blossom — Herbarium Paper v2",
  "appearance": "light",
  "settings": { "italics": true, "separatorStyle": "soft" },
  "colors": {
    "rosewater": "#8a4b32",
    "flamingo": "#a83556",
    "pink": "#a83556",
    "mauve": "#7f3f59",
    "red": "#b64b3f",
    "maroon": "#b64b3f",
    "peach": "#80522d",
    "yellow": "#725b18",
    "green": "#2f6f4e",
    "teal": "#2f6f4e",
    "sky": "#2b6b60",
    "sapphire": "#34685c",
    "blue": "#2f6f4e",
    "lavender": "#2b6b60",
    "text": "#245d51",
    "subtext1": "#404753",
    "subtext0": "#5a6371",
    "overlay2": "#747e8c",
    "overlay1": "#8992a0",
    "overlay0": "#a5adb8",
    "surface2": "#aeb8ca",
    "surface1": "#c4cad8",
    "surface0": "#d2d7e2",
    "base": "#f2f3f7",
    "mantle": "#e6e8ef",
    "crust": "#dce0e9"
  }
}
