{
  "$schema": "../schemas/palette.schema.json",
  "name": "Ink & Blossom — Sunlit Shell",
  "appearance": "dark",
  "settings": { "italics": true },
  "colors": {
    "rosewater": "#fdd4bd",
    "flamingo": "#f48067",
    "pink": "#eb5324",
    "mauve": "#f37f94",
    "red": "#eb5324",
    "maroon": "#f48067",
    "peach": "#eeb480",
    "yellow": "#b5decc",
    "green": "#96d1aa",
    "teal": "#c7d14f",
    "sky": "#b5decc",
    "sapphire": "#b4cdc2",
    "blue": "#96d1aa",
    "lavender": "#f8ed43",
    "text": "#fbe6a0",
    "subtext1": "#d7c98c",
    "subtext0": "#c2ad78",
    "overlay2": "#f8ed43",
    "overlay1": "#aa986b",
    "overlay0": "#786d52",
    "surface2": "#66583f",
    "surface1": "#443b2c",
    "surface0": "#2a251c",
    "base": "#111314",
    "mantle": "#211d18",
    "crust": "#0c0c0a"
  }
}
