{
  "$schema": "../schemas/palette.schema.json",
  "name": "Folio — Sunlit Shell Night",
  "appearance": "dark",
  "settings": { "italics": true, "separatorStyle": "soft" },
  "colors": {
    "rosewater": "#fdd4bd",
    "flamingo": "#f48067",
    "pink": "#eb5324",
    "mauve": "#f37f94",
    "red": "#eb5324",
    "maroon": "#f48067",
    "peach": "#eeb480",
    "yellow": "#b5decc",
    "green": "#96d1aa",
    "teal": "#c7d14f",
    "sky": "#b5decc",
    "sapphire": "#b4cdc2",
    "blue": "#96d1aa",
    "lavender": "#f8ed43",
    "text": "#fbe6a0",
    "subtext1": "#cacbc7",
    "subtext0": "#a2a39f",
    "overlay2": "#f8ed43",
    "overlay1": "#aa986b",
    "overlay0": "#786d52",
    "surface2": "#39464e",
    "surface1": "#29343b",
    "surface0": "#1c242a",
    "base": "#101519",
    "mantle": "#151b20",
    "crust": "#0a0d0f"
  }
}
