{
  "$schema": "../schemas/palette.schema.json",
  "name": "Ink & Blossom — Luminous Ink",
  "appearance": "dark",
  "settings": { "italics": true },
  "colors": {
    "rosewater": "#fdd4bd",
    "flamingo": "#eeb480",
    "pink": "#eb5324",
    "mauve": "#f37f94",
    "red": "#eb5324",
    "maroon": "#f48067",
    "peach": "#eeb480",
    "yellow": "#fdd4bd",
    "green": "#96d1aa",
    "teal": "#c7d14f",
    "sky": "#b5decc",
    "sapphire": "#b4cdc2",
    "blue": "#96d1aa",
    "lavender": "#f8ed43",
    "text": "#b5decc",
    "subtext1": "#a9c7ba",
    "subtext0": "#9dbdb0",
    "overlay2": "#f8ed43",
    "overlay1": "#89a89b",
    "overlay0": "#63756d",
    "surface2": "#4a5b4f",
    "surface1": "#354139",
    "surface0": "#222a24",
    "base": "#111314",
    "mantle": "#191e1b",
    "crust": "#0b0d0c"
  }
}
