{
  "$schema": "../schemas/palette.schema.json",
  "name": "Ink & Blossom — Herbarium Paper",
  "appearance": "light",
  "settings": { "italics": true },
  "colors": {
    "rosewater": "#a36752",
    "flamingo": "#cc1236",
    "pink": "#cc1236",
    "mauve": "#713b4c",
    "red": "#cc1236",
    "maroon": "#6d4145",
    "peach": "#6d4145",
    "yellow": "#71502f",
    "green": "#004f46",
    "teal": "#004f46",
    "sky": "#00978d",
    "sapphire": "#112f2c",
    "blue": "#004f46",
    "lavender": "#42533e",
    "text": "#112f2c",
    "subtext1": "#354e45",
    "subtext0": "#496158",
    "overlay2": "#42533e",
    "overlay1": "#5f7166",
    "overlay0": "#86988c",
    "surface2": "#c0d1ba",
    "surface1": "#cfdeca",
    "surface0": "#d9e6d0",
    "base": "#f1f5e9",
    "mantle": "#e4ecdc",
    "crust": "#dce7d5"
  }
}
