{
  "$schema": "../schemas/palette.schema.json",
  "name": "Ink & Blossom — Luminous Ink v2",
  "appearance": "dark",
  "settings": { "italics": true },
  "colors": {
    "rosewater": "#fdd4bd",
    "flamingo": "#eeb480",
    "pink": "#eb5324",
    "mauve": "#f37f94",
    "red": "#eb5324",
    "maroon": "#f48067",
    "peach": "#eeb480",
    "yellow": "#fdd4bd",
    "green": "#96d1aa",
    "teal": "#c7d14f",
    "sky": "#b5decc",
    "sapphire": "#b4cdc2",
    "blue": "#96d1aa",
    "lavender": "#f8ed43",
    "text": "#b5decc",
    "subtext1": "#c8cbc9",
    "subtext0": "#9fa5a1",
    "overlay2": "#f8ed43",
    "overlay1": "#89a89b",
    "overlay0": "#63756d",
    "surface2": "#303732",
    "surface1": "#242a26",
    "surface0": "#171c19",
    "base": "#0c0f0e",
    "mantle": "#101412",
    "crust": "#080a09"
  }
}
