{
  "$schema": "../schemas/palette.schema.json",
  "name": "Folio — Luminous Ink Day",
  "appearance": "light",
  "settings": { "italics": true, "separatorStyle": "soft" },
  "colors": {
    "rosewater": "#8a4b32",
    "flamingo": "#9a4f35",
    "pink": "#b63d21",
    "mauve": "#9f3354",
    "red": "#b63d21",
    "maroon": "#9d493d",
    "peach": "#8a572d",
    "yellow": "#8a4b32",
    "green": "#2f704d",
    "teal": "#5d6912",
    "sky": "#2b6b60",
    "sapphire": "#34685c",
    "blue": "#2f704d",
    "lavender": "#746700",
    "text": "#27312e",
    "subtext1": "#41484a",
    "subtext0": "#5a6265",
    "overlay2": "#737b7e",
    "overlay1": "#858d90",
    "overlay0": "#a5abad",
    "surface2": "#babdbe",
    "surface1": "#ccd0d1",
    "surface0": "#dde0e1",
    "base": "#f4f4f2",
    "mantle": "#e9eae8",
    "crust": "#dfe1df"
  }
}
