{
  "$schema": "../schemas/palette.schema.json",
  "name": "Ink & Blossom — Shell Paper v2",
  "appearance": "light",
  "settings": { "italics": true, "separatorStyle": "soft" },
  "colors": {
    "rosewater": "#8a4b32",
    "flamingo": "#a84938",
    "pink": "#b63d21",
    "mauve": "#9f3354",
    "red": "#b63d21",
    "maroon": "#a84938",
    "peach": "#8a572d",
    "yellow": "#2b6b60",
    "green": "#2f704d",
    "teal": "#5d6912",
    "sky": "#2b6b60",
    "sapphire": "#34685c",
    "blue": "#2f704d",
    "lavender": "#746700",
    "text": "#3f3a27",
    "subtext1": "#3d474c",
    "subtext0": "#59666c",
    "overlay2": "#718087",
    "overlay1": "#84939a",
    "overlay0": "#a2adb2",
    "surface2": "#adbcc4",
    "surface1": "#c3cfd5",
    "surface0": "#d1dade",
    "base": "#f1f4f5",
    "mantle": "#e5eaed",
    "crust": "#dbe2e6"
  }
}
