{
  "$schema": "../schemas/palette.schema.json",
  "name": "Folio — Spring Herbarium",
  "appearance": "dark",
  "settings": { "italics": true, "separatorStyle": "soft" },
  "colors": {
    "rosewater": "#fdd4bd",
    "flamingo": "#f37f94",
    "pink": "#f37f94",
    "mauve": "#ca92a8",
    "red": "#f48067",
    "maroon": "#f48067",
    "peach": "#eeb480",
    "yellow": "#fbe6a0",
    "green": "#96d1aa",
    "teal": "#96d1aa",
    "sky": "#b5decc",
    "sapphire": "#b4cdc2",
    "blue": "#96d1aa",
    "lavender": "#b5decc",
    "text": "#d8d6cf",
    "subtext1": "#c7cbc8",
    "subtext0": "#9fa5a1",
    "overlay2": "#b4cdc2",
    "overlay1": "#7f9b8f",
    "overlay0": "#5a6e64",
    "surface2": "#344b60",
    "surface1": "#25384a",
    "surface0": "#182635",
    "base": "#0c131b",
    "mantle": "#111b26",
    "crust": "#070b10"
  }
}
