{
  "$schema": "../schemas/palette.schema.json",
  "name": "Ink & Blossom — Spring Herbarium",
  "appearance": "dark",
  "settings": { "italics": true },
  "colors": {
    "rosewater": "#fdd4bd",
    "flamingo": "#f37f94",
    "pink": "#f37f94",
    "mauve": "#ca92a8",
    "red": "#f48067",
    "maroon": "#a36752",
    "peach": "#eeb480",
    "yellow": "#fbe6a0",
    "green": "#96d1aa",
    "teal": "#96d1aa",
    "sky": "#b5decc",
    "sapphire": "#b4cdc2",
    "blue": "#96d1aa",
    "lavender": "#b5decc",
    "text": "#b5decc",
    "subtext1": "#a7cabb",
    "subtext0": "#94b5a7",
    "overlay2": "#b4cdc2",
    "overlay1": "#7f9b8f",
    "overlay0": "#5a6e64",
    "surface2": "#4a5f50",
    "surface1": "#344339",
    "surface0": "#202b23",
    "base": "#111314",
    "mantle": "#19201b",
    "crust": "#0b0d0c"
  }
}
