{
  "$schema": "../schemas/palette.schema.json",
  "name": "Ink & Blossom — Sunlit Shell v2",
  "appearance": "dark",
  "settings": { "italics": true },
  "colors": {
    "rosewater": "#fdd4bd",
    "flamingo": "#f48067",
    "pink": "#eb5324",
    "mauve": "#f37f94",
    "red": "#eb5324",
    "maroon": "#f48067",
    "peach": "#eeb480",
    "yellow": "#b5decc",
    "green": "#96d1aa",
    "teal": "#c7d14f",
    "sky": "#b5decc",
    "sapphire": "#b4cdc2",
    "blue": "#96d1aa",
    "lavender": "#f8ed43",
    "text": "#fbe6a0",
    "subtext1": "#cacbc7",
    "subtext0": "#a2a39f",
    "overlay2": "#f8ed43",
    "overlay1": "#aa986b",
    "overlay0": "#786d52",
    "surface2": "#383629",
    "surface1": "#2a2921",
    "surface0": "#1c1b16",
    "base": "#0f0f0c",
    "mantle": "#14130f",
    "crust": "#090908"
  }
}
