{
  "$schema": "../schemas/palette.schema.json",
  "name": "Ink & Blossom — Luminous Paper",
  "appearance": "light",
  "settings": { "italics": true },
  "colors": {
    "rosewater": "#a36752",
    "flamingo": "#cc1236",
    "pink": "#cc1236",
    "mauve": "#713b4c",
    "red": "#cc1236",
    "maroon": "#6d4145",
    "peach": "#6d4145",
    "yellow": "#71502f",
    "green": "#004f46",
    "teal": "#004f46",
    "sky": "#00978d",
    "sapphire": "#42533e",
    "blue": "#004f46",
    "lavender": "#806e4b",
    "text": "#111314",
    "subtext1": "#35443c",
    "subtext0": "#4b5c53",
    "overlay2": "#806e4b",
    "overlay1": "#5c7066",
    "overlay0": "#83978d",
    "surface2": "#b9cebf",
    "surface1": "#ceddcf",
    "surface0": "#d8e7da",
    "base": "#f2f7f2",
    "mantle": "#e5eee7",
    "crust": "#dde9df"
  }
}
