{
  "$schema": "../schemas/palette.schema.json",
  "name": "Ink & Blossom — Shell Paper",
  "appearance": "light",
  "settings": { "italics": true },
  "colors": {
    "rosewater": "#a36752",
    "flamingo": "#cc1236",
    "pink": "#cc1236",
    "mauve": "#713b4c",
    "red": "#cc1236",
    "maroon": "#6d4145",
    "peach": "#71502f",
    "yellow": "#004f46",
    "green": "#004f46",
    "teal": "#42533e",
    "sky": "#00978d",
    "sapphire": "#004f46",
    "blue": "#42533e",
    "lavender": "#806e4b",
    "text": "#2b241a",
    "subtext1": "#4e4939",
    "subtext0": "#665e48",
    "overlay2": "#806e4b",
    "overlay1": "#786d52",
    "overlay0": "#a08e60",
    "surface2": "#d8c899",
    "surface1": "#e7d9b5",
    "surface0": "#f1e1b8",
    "base": "#fff8e6",
    "mantle": "#f7ecd1",
    "crust": "#efe1c2"
  }
}
