{
  "$schema": "../schemas/palette.schema.json",
  "name": "Folio — Luminous Ink",
  "appearance": "dark",
  "settings": { "italics": true, "separatorStyle": "soft" },
  "colors": {
    "rosewater": "#fdd4bd",
    "flamingo": "#eeb480",
    "pink": "#eb5324",
    "mauve": "#f37f94",
    "red": "#eb5324",
    "maroon": "#f48067",
    "peach": "#eeb480",
    "yellow": "#fdd4bd",
    "green": "#96d1aa",
    "teal": "#c7d14f",
    "sky": "#b5decc",
    "sapphire": "#b4cdc2",
    "blue": "#96d1aa",
    "lavender": "#f8ed43",
    "text": "#d8d6cf",
    "subtext1": "#c8cbc9",
    "subtext0": "#9fa5a1",
    "overlay2": "#f8ed43",
    "overlay1": "#89a89b",
    "overlay0": "#63756d",
    "surface2": "#373b3e",
    "surface1": "#292c2f",
    "surface0": "#1d1f21",
    "base": "#111214",
    "mantle": "#161719",
    "crust": "#0b0c0e"
  }
}
